index	answer	text
0	Yes	Privacy Policy Last modified: June 30, 2015 ( view archived versions)
1	Yes	Your continued use of the Services after such modifications will constitute your: (a) acknowledgment of the modified Privacy Policy; and (b) agreement to abide and be bound by the modified Privacy Policy.
2	Yes	If you do not want to receive e-mail or other mail from us, please use our User Administration pages to adjust your preferences. (If you do not want to receive legal notices from us, such as this Privacy Notice, those notices will still govern your use of IMDb, and it is your responsibility to review them for changes.)
3	Yes	Changes. We may update this Privacy Policy from time to time. If under any such update we make any material change to the way in which we treat your User Information, we will inform you of such change via email or by posting a notice on relevant areas of the Services. Any updated version of this Privacy Policy will be effective as of the date set forth therein.
4	No	This Site is committed to complying with the Self-Regulatory Principles for Online Behavioral Advertising. Click here for more information about this Site and online behavioral advertising.
5	No	Choice/Opt-out Valve gives users the option to receive promotional email communications from Valve. Users may opt out of these communications. Instructions for discontinuing receipt of promotional email communications from Valve will be provided in email communications to users.
6	No	IV. HOW DO WE USE COOKIES? Your Web browser offers cookies which, if you allow their use, store small amounts of data on your computer when you visit a website. Cookies do not contain any personally identifiable information about you and therefore cannot be used to identify you personally. Cookies assist us in tracking which of our features you like best, and also enable us to customize our content according to your preferences. You have the ability to accept or decline cookies by modifying your browser and our websites are viewable even if you disable the cookie function on your browser. However, if you disable cookies, some advanced and customized features or offerings on our site will not be available to you. In addition to collecting cookies, TEN may distribute, sell, and/or transfer such cookies to third parties with whom TEN has a commercial relationship. If you do not wish your cookies to be used in this manner, you can modify your browser to disable the collection of cookies.
7	No	It is important to remember, however, that no system can guarantee 100 security at all times. Accordingly, we cannot guarantee the security of information stored on or transmitted to or from our services. We cannot assume responsibility or liability for unauthorized access to our servers and systems. When disclosing any personal or protected health information, you should remain mindful of the fact that it is potentially accessible to the public and,consequently, can be collected and used by others without your consent. Accordingly, you should consider carefully if you want to submit sensitive information that you would not want disclosed to the public and should recognize that your use of the Internet and our sites and services is solely at your risk. You are ultimately responsible for maintaining the secrecy for all your personal information, including your protected health information. Except as provided in aBusiness Associate Agreement between us and a healthcare provider, we have no responsibility or liability to anyone for the security of your personal or protected health information transmitted via the Internet.
