index	answer	text
0	Yes	As a Business Associate of a particular healthcare provider, we may be permitted to de-identify your protected health information created or received by us for that healthcare provider. This de-identified information must be created according to criteria prescribed by HIPAA so that there is no reasonable basis to believe that this information can be traced back to you. We may use and disclose any such de-identified information in the same manner as personal information under this privacy policy.
1	Yes	6. Childrens Privacy We recognize the need to provide further privacy protections with respect to personal informationwe may collect from childrenon our sites and applications. Some of the features on our sites and applications are age-gated so that they are not available for use by children, and we do not knowingly collect personal information from children in connection with those features. When we intend to collect personal information from children, we take additional steps to protect childrens privacy, including:
2	Yes	Yahoo's participation in the Safe Harbor program Yahoo participates in the Safe Harbor program developed by the U.S. Department of Commerce and the European Union. To view our certification, visit the U.S. Department of Commerce's Safe Harbor Web site. For more information about Yahoo's participation in the Safe Harbor program, please visit our Safe Harbor details page.
3	Yes	To carry this promise through, we do not sell products for purchase by children. We sell children's products for purchase by adults. If you are under 18, you may use the Sites only with involvement of a parent or guardian.
4	No	d. Use of Information. Latin Post will not use a wireless telephone number, wireless or conventional Internet email address, or other Information submitted for its wireless marketing services for any other purpose but to provide the service requested, unless we provide advance notice of any other use. We will not share any Personal Information with Advertisers or other third party marketers unless you opt-in to such disclosure. We will share Personal Information with the operational service providers that assist us in delivering these wireless services to you and with the Parent Companies and Affiliates.
5	No	Mobile Apps For additional information about your choices in relation to Mobile Apps including information on how to opt out of targeted advertising see the Mobile Apps policy.
6	No	10. CHANGES TO OUR PRIVACY POLICY Instagram may modify or update this Privacy Policy from time to time, so please review it periodically. We may provide you additional forms of notice of modifications or updates as appropriate under the circumstances. Your continued use of Instagram or the Service after any modification to this Privacy Policy will constitute your acceptance of such modification.
7	No	Microsoft account Microsoft account is a service that lets you sign in to Microsoft products, web sites and services, as well as those of select Microsoft partners. When you create a Microsoft account, we ask you to provide certain information. When you sign in to a site or service using your Microsoft account, we collect certain information in order to verify your identity on behalf of the site or service, to protect you from malicious account usage and to protect the efficiency and security of the Microsoft account service. We also send some of this information to sites and services that you sign in to with your Microsoft account.
